{
    "time_window": "2026-01-15_to_2026-02-28",
    "north_star_candidate": "Activated accounts (completed onboarding + created first project)",
    "funnel": {
      "signup_to_onboarding_start": { "baseline": 0.82, "trend": "flat" },
      "onboarding_start_to_completion": { "baseline": 0.54, "trend": "down_10_percent_relative" },
      "onboarding_completion_to_first_project": { "baseline": 0.62, "trend": "flat" }
    },
    "product_health": {
      "dashboard_p95_latency_seconds": { "baseline": 3.1, "current": 5.4, "trend": "up" },
      "login_related_tickets_weekly": { "baseline": 45, "current": 55, "trend": "up_22_percent" }
    },
    "guardrails": {
      "error_rate_auth": { "baseline": 0.012, "current": 0.018, "trend": "up" },
      "support_csatscore": { "baseline": 4.2, "current": 4.0, "trend": "down" }
    },
    "instrumentation_gaps": [
      "Missing event for onboarding_step_viewed with step_id",
      "No consistent user_segment tag on onboarding events",
      "No baseline for accessibility-related friction events"
    ]
  }